{
  "id": "glpat_secret_deny",
  "description": "PAT-shaped substring in argv (canary for pack has-sub glpat-). Not a URL; not a live secret.",
  "method": "checkShell",
  "agentId": {
    "hi": 1,
    "lo": 2
  },
  "cwd": "/ws",
  "argv": [
    "printf",
    "%s",
    "token=glpat-TEST"
  ],
  "expect": {
    "decision": 0,
    "code": 27
  }
}
